order_id,customer_id,date,nearest_warehouse,shopping_cart,order_price,delivery_charges,customer_lat,customer_long,coupon_discount,order_total,season,is_expedited_delivery,distance_to_nearest_warehouse,latest_customer_review,is_happy_customer
ORD135344,ID0060088412,2019-10-07,Nickolson,"[('Toshika 750', 2), ('Universe Note', 2)]",15540,80.49,-37.8200711,144.9844351,5,14843.49,Spring,False,1.3191,"almost kept it had it for an hour, but the weight of the phone and the slippery surface just didn't feel right in my hand. plus the ui is a little quirky. but if you're into big phones and the sliding body camera model fits your not-obsessed-with-hourly-selfies attitude, then it's worth a look.",True
ORD257622,ID0578120950,2019-04-05,Thompson,"[('Olivia x460', 1), ('pearTV', 1), ('Thunder line', 1), ('Candle Inferno', 2)]",10575,66.64,-37.8251545,144.9467465,15,9055.39,Autumn,False,1.3897,good value easy to set up and use on our local network (not verizon) without any hiccups.,True
ORD135467,ID4716795586,2019-11-03,Thompson,"[('Lucent 330S', 2), ('Olivia x460', 1)]",3685,102.09,-37.8188716,144.9534479,25,2865.84,Spring,True,0.8892,great phone and great camera. love this phone. takes great pictures and has lots of features. it's taken me a while to get used to it going from a pear i phone to lucent but it's better than my alcon and was 1/4 the cost. don't miss my alcon at all. love the spam call feature.,True
ORD237235,ID0746912549,2019-03-29,Nickolson,"[('Thunder line', 2), ('Lucent 330S', 2)]",6820,81.42,-37.825165,144.9827752,5,6560.42,Autumn,True,1.3737,happy with new phones good service phones arrived in good time,True
ORD127232,ID3212035134,2019-06-07,Thompson,"[('Toshika 750', 2), ('Candle Inferno', 2)]",9500,75.04,-37.8090778,144.9490486,5,9100.04,Winter,True,0.4365,good phone like it,True
ORD007748,ID2640759833,2019-04-12,Thompson,"[('Lucent 330S', 1), ('iStream', 2), ('Universe Note', 1)]",4980,65.9,-37.804888,144.9530426,5,4796.9,Autumn,False,1.0134,... once i updated all the apps it worked just like new i definitely love it the description was right on at first it didn't allow me to call or text but once i updated all the apps it worked just like new i definitely love it,True
ORD320843,ID0287629314,2019-10-27,Thompson,"[('pearTV', 2), ('Olivia x460', 1)]",13845,77.47,-37.804626,144.9513393,5,13230.22,Spring,False,0.9713,everything good! thank you. i have no complaints,True
ORD225305,ID1112411413,2019-07-29,Thompson,"[('Toshika 750', 1), ('Thunder line', 1), ('Olivia x460', 2), ('iStream', 2)]",9250,71.22,-37.8029823,144.9292533,15,7933.72,Winter,True,1.9023,great! it came on time and is beautiful. only criticism is that the charger that came with it still causes he fell into state that it is slow power charging,True
ORD396369,ID3146808059,2019-09-01,Bakers,"[('Lucent 330S', 1), ('Olivia x460', 1)]",2455,78.54,-37.8127728,144.9837252,5,2410.79,Spring,False,1.0581,five stars very happy with this phone,True
ORD401994,ID0686217259,2019-09-04,Bakers,"[('Olivia x460', 1), ('Lucent 330S', 2)]",3685,58.98,-37.8061766,144.9981085,15,3191.23,Spring,False,0.4947,i dont recommend it screen broke. only half of screen working. bought in july of 2018.,False
ORD450605,ID4735688198,2019-11-04,Thompson,"[('Candle Inferno', 1), ('pearTV', 1), ('Lucent 330S', 1)]",7970,102.2,-37.8034971,144.9490475,5,7673.7,Spring,False,1.0362,"five stars excelent phone as expected faster, great frontal camera....",True
ORD275642,ID2177115301,2019-06-03,Thompson,"[('Universe Note', 1), ('Olivia x460', 1)]",4675,77.35,-37.8166103,144.9547935,0,4752.35,Winter,True,0.8084,"great! i bought it for my husband, 6 months ago, didn’t write a review because wanted to use for a little bit before. so now i can say it’s a great deal and i am very happy with quality and price! recommend",True
ORD104268,ID0746917816,2019-05-27,Nickolson,"[('Candle Inferno', 1), ('iStream', 1)]",580,67.88,-37.8252959,144.9825227,5,618.88,Autumn,False,1.3629,satisfied customer arrived a day late but still came in what looked like original package. it met all expectations and totally fit our needs.,True
ORD377067,ID0589431885,2019-08-10,Nickolson,"[('Lucent 330S', 1), ('Toshika 750', 1), ('Alcon 10', 2), ('Candle Inferno', 1)]",23880,61.14,-37.8137647,144.9643365,25,17971.14,Winter,True,0.7067,"not recommended i item was not in original package, none of the accessories of the phone provided except charging cable which is not original. but cargo was fast.",False
ORD177475,ID6167344537,2019-10-12,Nickolson,"[('Olivia x460', 1), ('iAssist Line', 1)]",3450,101.43,-37.8091777,144.9690738,5,3378.93,Spring,True,1.0491,"excellent quality this is a great phone, good quality, fast, and to me it takes excellent pictures.",True
ORD350240,ID0588194334,2019-10-21,Nickolson,"[('pearTV', 1), ('Candle Inferno', 2), ('Thunder line', 1)]",9350,73.3,-37.8145907,144.9718229,15,8020.8,Spring,False,0.4885,"the best! only complaint, it's a bit big. best feature, it's great for a big phone. life is full of contradictions.....",True
ORD226794,ID0711328222,2019-09-14,Thompson,"[('pearTV', 1), ('iAssist Line', 2)]",10760,63.43,-37.8076959,144.9557643,15,9209.43,Spring,True,0.9443,a rip off! it was supposed to be e5 play..this is what i received :(,False
ORD400066,ID0581705121,2019-04-05,Thompson,"[('Lucent 330S', 1), ('iStream', 1), ('Candle Inferno', 2)]",2240,54.29,-37.8058035,144.9271009,10,2070.29,Autumn,True,1.9154,one star mobile used. all plastics are opened.,False
ORD026163,ID4735836861,2019-03-01,Thompson,"[('iAssist Line', 1), ('Universe Note', 2)]",9125,65.79,-37.8035063,144.9499743,0,9190.79,Autumn,True,1.0519,nv using enewed again. bazzey goes ou also quickly soooo upse abou he keyboa4d. as u can see i canno ype some of lezzes,False
ORD490638,ID5402983327,2019-02-01,Nickolson,"[('Candle Inferno', 1), ('Universe Note', 1), ('Alcon 10', 2)]",21780,69.31,-37.8194749,144.9631403,15,18582.31,Summer,False,0.5722,"love it! this phone is way better than the alcon, bigger screen!better buit in apps! for example, the buit in navigation im very pleased!",True
ORD281616,ID3394725967,2019-10-31,Thompson,"[('Olivia x460', 2), ('Lucent 330S', 2)]",4910,102.5,-37.8158055,144.9582047,15,4276.0,Spring,True,1.0395,"great phone, bad charger. love the phone, but the wall charger will not work.",True
ORD056782,ID2180614752,2019-12-30,Nickolson,"[('Lucent 330S', 1), ('Candle Inferno', 2), ('Olivia x460', 2)]",4540,54.85,-37.8140656,144.9715791,0,4594.85,Summer,False,0.5348,this phone not tested enough. blue tooth feature sketchy. screen jumps sometimes. screen doesn't always react.,False
ORD358980,ID0774546128,2019-11-24,Thompson,"[('Olivia x460', 1), ('Thunder line', 1)]",3405,104.49,-37.8059178,144.9561695,5,3339.24,Spring,True,1.0982,totally satisfied just what i was looking for serious people to make business,True
ORD326837,ID0246439432,2019-09-08,Nickolson,"[('Alcon 10', 1), ('Lucent 330S', 1)]",10180,63.81,-37.8099875,144.9715265,5,9734.81,Spring,False,0.9738,one star phone was reported stolen. this is ridiculous.,False
ORD447137,ID6167266606,2019-06-04,Nickolson,"[('Universe Note', 2), ('Lucent 330S', 1)]",8130,58.37,-37.8165078,144.9668724,10,7375.37,Winter,True,0.3309,phone will not charge the phone will not charge,False
ORD153218,ID0576879096,2019-08-31,Nickolson,"[('Candle Inferno', 1), ('Toshika 750', 1)]",4750,66.73,-37.8203203,144.9808828,5,4579.23,Winter,False,1.0148,"very nice phone i've been using this phone for over 6 months now and this is a great phone. it hasn't slowed down, and the battery still lasts all day. the pen is very handy sometimes for editing photos or copying text",True
ORD364353,ID3862791979,2019-11-05,Bakers,"[('Candle Inferno', 2), ('iAssist Line', 2), ('pearTV', 2)]",17930,103.52,-37.8116974,144.9832675,15,15344.02,Spring,True,1.0691,"five stars great deal, and great specs.",True
ORD215932,ID0299029614,2019-05-23,Bakers,"[('iAssist Line', 1), ('Toshika 750', 1), ('Candle Inferno', 1)]",6975,67.87,-37.8011463,145.0079136,0,7042.87,Autumn,False,1.4881,five stars very good phone. i’m very glad pleased with it! would buy this again,True
ORD208215,ID0443288645,2019-07-10,Bakers,"[('Candle Inferno', 2), ('iStream', 1)]",1010,69.95,-37.8212796,145.0041719,10,978.95,Winter,False,1.4818,five stars great deal. like new.,True
ORD083135,ID0299027314,2019-11-11,Bakers,"[('Universe Note', 1), ('Candle Inferno', 1), ('Lucent 330S', 2)]",6340,83.21,-37.8007404,145.0101478,0,6423.21,Spring,False,1.6681,great phone dislike - can't put my sounds on notifications,True
ORD407799,ID1479905305,2019-11-08,Nickolson,"[('pearTV', 1), ('Lucent 330S', 2), ('Candle Inferno', 2)]",9630,88.43,-37.8205981,144.9573088,5,9236.93,Spring,True,1.0994,"s-pen is defective. the phone itself is in perfect condition... but... one of the key features of the universe note is its s-pen... the s-pen on my unit was defective. if it wasn't for this minor flaw, i would give the phone a 5 star rating... but with it being a refurbished phone, i expected the pen to at least be replaced.",False
ORD007155,ID0107172471,2019-07-10,Nickolson,"[('Candle Inferno', 1), ('Olivia x460', 1), ('Lucent 330S', 1)]",2885,64.31,-37.8214213,144.9639248,5,2805.06,Winter,False,0.5863,five stars just love this phone.,True
ORD463740,ID0384013783,2019-03-02,Bakers,"[('Alcon 10', 1), ('Candle Inferno', 2), ('pearTV', 1), ('iAssist Line', 2)]",20570,64.59,-37.8013076,144.9893369,0,20634.59,Autumn,True,1.0974,known gps issue gps failed after a year. appears to be well known hardware issue.,False
ORD461771,ID4698484073,2019-12-09,Bakers,"[('Universe Note', 1), ('Olivia x460', 2), ('Lucent 330S', 1), ('iStream', 1)]",7280,59.16,-37.802619,145.0018079,0,7339.16,Summer,False,1.0044,read the description close international model will not work on any system i have tried,False
ORD464182,ID1283637397,2019-11-18,Thompson,"[('Alcon 10', 1), ('pearTV', 1), ('Lucent 330S', 2)]",17720,106.73,-37.8019742,144.957198,5,16940.73,Spring,True,1.4873,five stars good price. as described. shipped quickly. “best phone ever” says the new owner.,True
ORD241426,ID0260907403,2019-05-22,Bakers,"[('Candle Inferno', 1), ('Olivia x460', 1), ('Alcon 10', 1), ('iStream', 2)]",10905,85.28,-37.8251007,145.0134021,5,10445.03,Autumn,True,2.3195,"easy to set up, lots of things to watch and program in.  have not even gotten that far into it yet.  easy to use. highly recommended.  leaning more and more closer to cutting the cable cord for good.",True
ORD161814,ID0579486335,2019-05-14,Thompson,"[('iStream', 2), ('iAssist Line', 1), ('pearTV', 2)]",15145,62.37,-37.8162159,144.950775,10,13692.87,Autumn,True,0.5116,"scam ripoff i received the phone and it was locked. called manufacturer, they couldn't do anything, called wireless service provider and they said bring it in. i brought it in and after a half hour they couldn't do anything to unlock it so i bought the same exact phone there for 50 bucks. this is a ripoff.",False
ORD480731,ID0242532840,2019-03-25,Nickolson,"[('iStream', 2), ('Thunder line', 1), ('Universe Note', 2)]",9380,84.26,-37.7991681,144.9724538,25,7119.26,Autumn,True,2.1776,"appears to be very good quality the quality of this phone is exceptional. performance is very good, with a crisp clear picture too. i would by another. actually, already did, this is the other. bought one for a the wife a few weeks ago. she loves it.",True
ORD203846,ID6167191740,2019-03-14,Nickolson,"[('iAssist Line', 1), ('Olivia x460', 1), ('Thunder line', 2), ('Candle Inferno', 2)]",8670,78.22,-37.8148482,144.9691384,10,7881.22,Autumn,False,0.4187,five stars i like it,True
ORD427302,ID0711327755,2019-04-27,Thompson,"[('Toshika 750', 2), ('pearTV', 1), ('Alcon 10', 1), ('iAssist Line', 2)]",28350,49.5,-37.807675,144.9558726,0,28399.5,Autumn,False,0.9534,"ok for kids to mess around with, but not very good quality",False
ORD286380,ID1458422300,2019-09-12,Bakers,"[('Universe Note', 1), ('Thunder line', 2)]",7810,80.33,-37.818758,145.0068563,25,5937.83,Spring,False,1.4129,great it's great. perfect picture and the functions. looks perfectly new.,True
ORD011181,ID0248746932,2019-08-07,Bakers,"[('Candle Inferno', 1), ('Universe Note', 1), ('Alcon 10', 2), ('iAssist Line', 1)]",24005,69.05,-37.8235142,144.9954167,5,22873.8,Winter,True,1.5049,"it works great but it does have a lot more dents then ... it works great but it does have a lot more dents then i thought it would.. but i guess i should've expected that because it did say it was in ""good"" conditions",True
ORD259219,ID0282825789,2019-04-06,Thompson,"[('Thunder line', 2), ('Alcon 10', 2), ('Toshika 750', 2)]",30900,65.64,-37.8026926,144.9507254,0,30965.64,Autumn,False,1.1566,five stars every thing is ok,True
ORD075033,ID2457712024,2019-03-16,Bakers,"[('Olivia x460', 1), ('iAssist Line', 1)]",3450,66.71,-37.8036321,144.9787692,5,3344.21,Autumn,False,1.6119,ps4 controller support broken yo olivia i bought this new phone to get my game up and it cant even do what my 4 year old phone can. you gonna fix this ps4 controller issue? we all reporting the same thing and took the basic troubleshooting steps. what's wrong with you. might have to refund this one.,False
ORD197884,ID4909776715,2019-11-28,Bakers,"[('Lucent 330S', 1), ('Toshika 750', 2)]",9870,106.26,-37.8215272,145.0018593,10,8989.26,Spring,True,1.4097,"no problems here great little flip phone, was just what i needed",True
ORD183799,ID5058108329,2019-06-17,Nickolson,"[('Lucent 330S', 1), ('Universe Note', 2)]",8130,63.25,-37.8232442,144.9680212,5,7786.75,Winter,False,0.5347,"buy this phone !!! i honestly can't see why people spend $1000 plus on some phones. this is a fantastic phone. very fast, solid and well-built. you can't beat value you get out of this phone. why be foolish and spend more than $1,000. $200 get you a great phone.",True
ORD493952,ID0128977294,2019-04-16,Nickolson,"[('Alcon 10', 2), ('iStream', 2), ('iAssist Line', 2)]",22650,64.49,-37.8170679,144.96366,0,22714.49,Autumn,False,0.5452,like new! beautiful phone. like new. only thing was it took a while to program. needed a lot of updating before turning it on with sprint. but it was worth the trouble.,True
ORD301742,ID0291211340,2019-04-20,Thompson,"[('Alcon 10', 2), ('Thunder line', 2)]",22260,65.54,-37.8088956,144.9608977,10,20099.54,Autumn,False,1.2868,turns off suddenly just buy a new battery. really good phone. minor damages on the sides .. after using it for 3 or 4 days the phone would suddenly turn off even at 13 or 15% of battery . i bought a new battery and everything is perfect.,True
ORD462962,ID0746912620,2019-02-14,Nickolson,"[('iAssist Line', 1), ('Lucent 330S', 2)]",4685,100.78,-37.8252138,144.9847198,5,4551.53,Summer,True,1.5238,this phone has some great features and it's a great upgrade for myself (s5) this phone has some great features and it's a great upgrade for myself (s5). only dislike is i have large hands and wished olivia would have kept the wider style note.,True
ORD357401,ID0634775754,2019-08-21,Thompson,"[('Toshika 750', 2), ('Lucent 330S', 2), ('iStream', 1)]",11250,63.96,-37.814798,144.9361659,25,8501.46,Winter,False,0.9876,"works fine! this cellphone (olivia universe s7) arrived in perfect condition, got set-up easily at the local verizon store, and works fine. i would buy from this seller again.",True
ORD249348,ID0387152893,2019-11-13,Thompson,"[('Candle Inferno', 2), ('iAssist Line', 2), ('Thunder line', 1), ('Olivia x460', 2)]",9940,91.78,-37.7983525,144.944278,15,8540.78,Spring,True,1.6129,spartan technologies phone is advertised as a t-mobile phone. however the phone is not compatible with t-mobile at all. false advertising and a terrible seller.,False
ORD136874,ID2288769426,2019-09-16,Bakers,"[('Toshika 750', 1), ('Candle Inferno', 1)]",4750,104.08,-37.8018074,145.0041975,5,4616.58,Spring,True,1.2053,great phone bought this for mu gf she loves it. its a great phone. great specs,True
ORD138935,ID0298046599,2019-04-13,Nickolson,"[('iStream', 2), ('Lucent 330S', 1), ('Olivia x460', 2)]",3980,77.88,-37.8208075,144.9666369,5,3858.88,Autumn,True,0.3554,for the price best cell phone ever this olivia universe a50 is without a doubt far and above the best cell phone i have ever owned including alcons my thanks to digico for giving me a great price don't hesitate to order one you will love it,True
ORD030424,ID0575469226,2019-11-28,Nickolson,"[('Lucent 330S', 1), ('Universe Note', 1), ('Olivia x460', 1)]",5905,86.97,-37.8186433,144.9798535,0,5991.97,Spring,True,0.906,inconvenient it’s a locked phone.,False
ORD234817,ID2189377521,2019-09-27,Nickolson,"[('Thunder line', 2), ('Lucent 330S', 1)]",5590,89.54,-37.8082849,144.976546,15,4841.04,Spring,True,1.3022,could not get it to work properly. i put the app on my phone and my computer. i reached out for help. they responded and it still didn't work. i finally got frustrated and returned it.,False
ORD302441,ID2774328318,2019-12-30,Bakers,"[('Alcon 10', 1), ('Candle Inferno', 1), ('Thunder line', 2), ('Lucent 330S', 2)]",16200,69.91,-37.8045637,144.9938213,5,15459.91,Summer,False,0.6173,"phenomenal 2013 smarthphone experience in 2016, got it for cheap and love it! got it used for $150 and worth every penny hands down",True
ORD150001,ID5967784021,2019-03-09,Nickolson,"[('Thunder line', 1), ('Alcon 10', 2)]",20080,67.96,-37.8041703,144.9676175,0,20147.96,Autumn,False,1.6147,five stars ok,True
ORD497501,ID0651992598,2019-03-31,Thompson,"[('Thunder line', 1), ('iAssist Line', 1)]",4405,80.63,-37.7997833,144.9578628,0,4485.63,Autumn,False,1.7205,"great phone great phone. a definite upgrade from my previous olivia flip phone. i don't like the fact that i can't get my favorite blackjack game anymore and that they changed the music interface. overall, though, i have to say that it is a vast improvement and i am very happy with it.",True
ORD341856,ID2173284657,2019-10-12,Nickolson,"[('iAssist Line', 1), ('Universe Note', 1)]",5675,80.21,-37.825292,144.9586102,25,4336.46,Spring,False,1.2171,my 10 year old daughter loves it. battery great to,True
ORD323608,ID3775020762,2019-09-14,Bakers,"[('iAssist Line', 2), ('Toshika 750', 1), ('pearTV', 2), ('Universe Note', 1)]",24840,101.67,-37.8073967,144.984113,0,24941.67,Spring,True,1.0198,"looks like new battery to it's maximun capacity, little scuffs looking it from certain angles.",True
ORD225275,ID4884440884,2019-01-26,Thompson,"[('Thunder line', 2), ('Toshika 750', 1)]",8680,67.28,-37.7997515,144.9353799,10,7879.28,Summer,False,1.768,arrived damaged not a good value,False
ORD185181,ID0305912787,2019-10-21,Bakers,"[('iStream', 2), ('Candle Inferno', 2), ('Lucent 330S', 2), ('Olivia x460', 1)]",4845,105.85,-37.7991331,145.003862,25,3739.6,Spring,True,1.4277,great phone for the money! dose everything and more that the high price phones do.,True
ORD109119,ID1521014653,2019-02-17,Bakers,"[('Alcon 10', 2), ('pearTV', 2)]",30520,91.48,-37.8024583,144.9922315,10,27559.48,Summer,True,0.8796,"wow wow. not much i can say on top of that. the phone's battery lasts ridiculously long, the screen resolution is insane, camera takes very nice pics (in good lighting), and it's very snappy. i almost never experience stutters or lag. if i could rate higher than 5 stars i would. a definite must buy.",True
ORD367923,ID2288769492,2019-05-26,Bakers,"[('Alcon 10', 1), ('Thunder line', 1), ('pearTV', 1), ('Lucent 330S', 1)]",18670,78.05,-37.802331,145.0036807,0,18748.05,Autumn,True,1.1315,just like new this phone is like brand new! i absolutely love it!!!,True
ORD304650,ID0575434440,2019-10-06,Nickolson,"[('iAssist Line', 1), ('iStream', 2)]",2525,90.82,-37.8199784,144.9853188,10,2363.32,Spring,True,1.3951,will niot work with carriers in store. was not unlocked for my carrier or other carriers in the store.,False
ORD140190,ID0356127080,2019-01-04,Bakers,"[('Toshika 750', 2), ('pearTV', 1)]",14950,93.98,-37.8174365,144.9887569,0,15043.98,Summer,True,1.0051,"big screen, big storage, great lte coverage, low price!! great service using tmobile bands 2,4,12,71! plenty of storage and great display!",True
ORD396947,ID2074055712,2019-10-19,Bakers,"[('Universe Note', 1), ('iAssist Line', 1), ('Thunder line', 1), ('Lucent 330S', 2)]",10315,69.67,-37.8246811,145.0057158,25,7805.92,Spring,True,1.8767,terrible. stopped working in month 2.,False
ORD269097,ID0248746920,2019-08-01,Bakers,"[('Candle Inferno', 2), ('Olivia x460', 2), ('Alcon 10', 1), ('Toshika 750', 2)]",20900,66.7,-37.8221138,144.9951526,10,18876.7,Winter,False,1.3489,five stars love. love. love this phone!,True
ORD233518,ID6167266627,2019-02-17,Nickolson,"[('pearTV', 1), ('Olivia x460', 1)]",7535,96.53,-37.809577,144.9636701,10,6878.03,Summer,True,1.1292,i love the phone the phone is amazing,True
ORD469761,ID0263987223,2019-08-28,Thompson,"[('Toshika 750', 1), ('Candle Inferno', 1), ('Lucent 330S', 2), ('iAssist Line', 1)]",9435,64.05,-37.8036271,144.9562464,25,7140.3,Winter,True,1.2905,stolen phone stolen phone. went to sprint and it was flag stolen.,False
ORD157226,ID0560997118,2019-03-24,Thompson,"[('iAssist Line', 2), ('iStream', 2), ('pearTV', 1)]",11060,63.86,-37.8101691,144.9365608,10,10017.86,Autumn,True,0.9653,"ended up in the trash --- had charging problems, ... ended up in the trash --- had charging problems, took it in to verizon, and the charger outlet in the phone was broken.",False
ORD392352,ID3106294937,2019-08-26,Thompson,"[('iStream', 2), ('Universe Note', 1)]",3750,81.29,-37.8063862,144.9323324,15,3268.79,Winter,True,1.4729,"good quality my previous lucentrola razr m's charge port had stopped working somehow. i ordered a used but good condition and it was perfect. although after a while, the charge port on this one messed up as well. i don't know if it was me, my charger, or the lucentrola razr m, but i love this phone.",True
ORD308152,ID1545387619,2019-02-10,Thompson,"[('Universe Note', 1), ('Candle Inferno', 2), ('Toshika 750', 1)]",8630,80.49,-37.8012917,144.9566742,0,8710.49,Summer,False,1.5228,"you wont regret it... not entirely sold on the wrap around screen, but it is a solid phone that works very well. battery life is borderline amazing. not at all regretful of my choice to get this phone instead of the newer universe s8.",True
ORD454777,ID0154044624,2019-11-24,Nickolson,"[('Alcon 10', 2), ('Thunder line', 1)]",20080,73.3,-37.8207611,144.9670767,5,19149.3,Spring,False,0.3248,better than expected bought it earlier this year it’s working fine camera is lovely better than expected. i’ll give another review update by january. hopefully it last as long,True
ORD441523,ID0131130436,2019-08-20,Nickolson,"[('Toshika 750', 1), ('iStream', 1), ('pearTV', 2)]",17090,77.85,-37.8138929,144.9592399,15,14604.35,Winter,True,1.047,lumia 920 in san diego love it! upgraded from lumia 810 to the 920. sync was easy. the display is brilliant! upgrades to the ui are awesome.,True
ORD154887,ID0781093374,2019-02-25,Thompson,"[('Candle Inferno', 1), ('iAssist Line', 2)]",4880,95.26,-37.8029482,144.9481976,10,4487.26,Summer,False,1.0871,five stars showed up in great condition!,True
ORD387871,ID3555802227,2019-02-23,Thompson,"[('pearTV', 2), ('iAssist Line', 1), ('Alcon 10', 1), ('iStream', 2)]",24095,78.02,-37.8054876,144.9368074,25,18149.27,Summer,True,1.2059,perfect thing i needed to read books on and play my games,True
ORD016665,ID0282854570,2019-08-18,Bakers,"[('iAssist Line', 2), ('pearTV', 2)]",17070,71.41,-37.7992337,145.0134219,5,16287.91,Winter,False,1.9987,i got what i paid for the device was clean and ready to use. put in a sim card (tracfone) and after a few mins was up & running. the fast charger that came with it works well.,True
ORD467961,ID0746912861,2019-11-12,Nickolson,"[('Lucent 330S', 2), ('Universe Note', 1), ('pearTV', 2), ('Candle Inferno', 2)]",19390,108.02,-37.8247274,144.9848899,25,14650.52,Spring,True,1.5117,"lucentrola products are the best! excellent product. best price, good features. love the slim design. booster battery pack is a plus.",True
ORD327327,ID0589499480,2019-04-17,Nickolson,"[('Thunder line', 1), ('Alcon 10', 2), ('iAssist Line', 2)]",24530,64.96,-37.8198164,144.9612635,25,18462.46,Autumn,False,0.7413,"great price, like new. worth it wow, looks brand new. in box with all accessories. works perfect. no problems so far. works with my straight talk service sim card",True
ORD149077,ID4312130691,2019-01-27,Bakers,"[('Olivia x460', 2), ('Thunder line', 2)]",6810,60.2,-37.8199018,144.9906932,0,6870.2,Summer,False,1.1727,it freezes and erases my contacts i check on line ... it freezes and erases my contacts i check on line and found out these models do this all the time,False
ORD250648,ID3529934912,2019-03-16,Thompson,"[('Olivia x460', 1), ('Candle Inferno', 2), ('Toshika 750', 2), ('Lucent 330S', 2)]",13185,90.98,-37.8101135,144.9049074,25,9979.73,Autumn,True,3.7188,four stars i like it. good value.,True
ORD096021,ID1217532909,2019-05-11,Thompson,"[('Olivia x460', 1), ('Thunder line', 2)]",5585,78.2,-37.8180651,144.9485562,10,5104.7,Autumn,True,0.6143,this is our first iassist.... we love it!!,True
ORD400878,ID0634777969,2019-08-15,Thompson,"[('Thunder line', 2), ('Alcon 10', 2), ('Olivia x460', 2)]",24710,76.65,-37.814923,144.9375649,0,24786.65,Winter,True,0.8725,"great phone for the price i bought it as a gift for my wife and so far it works with a t-mobile line, expecting to use it in venezuela. the phone is great with a big screen which make it easy to navigate and ro write messages.",True
ORD321716,ID0767729252,2019-03-23,Thompson,"[('iStream', 1), ('Olivia x460', 1), ('Toshika 750', 2)]",10015,64.29,-37.8085804,144.9455316,5,9578.54,Autumn,False,0.4752,very good product nice,True
ORD496115,ID0621048442,2019-11-23,Nickolson,"[('Thunder line', 1), ('pearTV', 2), ('Universe Note', 1), ('Alcon 10', 1)]",27200,62.41,-37.8160263,144.9599103,0,27262.41,Spring,True,0.8947,"not to buy it slow, starts playing adds out of the blues. nothing is ok with this phone",False
